{
	"adapter": {
		"sourceDigest": "7e5979082b8588440db3b8f23c6ddb3f9948c2ce2a116f7491d9d53f67d0e449",
		"tool": "consequence-review-report",
		"version": "1"
	},
	"artifact_ref": "graphrefly-stack:consequence-review-proof",
	"axes": [
		{
			"evidence": {
				"reasons": [],
				"status": "verified"
			},
			"human": {
				"status": "needs-review",
				"targetDigest": "4b6984c188b72f77f65c0e31d26b46b46b23de2053b5dd615565819a44e5d836"
			},
			"ownerAdmission": null
		},
		{
			"evidence": {
				"reasons": [],
				"status": "verified"
			},
			"human": {
				"status": "needs-review",
				"targetDigest": "0a28ef2fff33a661e87a865f87f35a1a70fd8000faa3f84fed6312a46f1532d5"
			},
			"ownerAdmission": null
		}
	],
	"compression": {
		"available": 43,
		"reviewed": 10,
		"unit": "distinct decision-surface entries / bound technical records"
	},
	"guidance": {
		"coverage": {
			"complete": true,
			"scope": [
				"AdmitRefresh",
				"ApplyBrokerPolicy",
				"BuildHttpRefreshOutcome",
				"EmitSecurityAudit",
				"EvaluateSessionPolicy",
				"IndependentPasswordResetFlow",
				"MapFailureResponse",
				"PersistSession",
				"SessionStore",
				"UpdateSessionMetrics",
				"ValidateTokenContract"
			]
		},
		"id": "470e445c24bb25fe22e0c263054379e504c4d6f00cbda8a747a749fc5420de1b",
		"integration": {
			"candidateDigest": "e9066f6715b5b1376fc6797f96063922144c668575fe2d6414c8eee8c4d807df",
			"outcome": "compatible",
			"resultDigest": "b22ed2d4bcdadb813e3cc29ff9ad86f766a85cadc4e93ab8f44b556f2ffaec8b",
			"verifierDigest": "78bcb76a134bbc18710eb7d6c3b6270875d3afeeae79f1baee5eb6199172872c"
		},
		"leftProjectionId": "4b6984c188b72f77f65c0e31d26b46b46b23de2053b5dd615565819a44e5d836",
		"rightProjectionId": "0a28ef2fff33a661e87a865f87f35a1a70fd8000faa3f84fed6312a46f1532d5",
		"schema": "graphrefly.stack.consequence-guidance.v1",
		"status": "overlap-observed",
		"witnesses": [
			{
				"kind": "graph",
				"value": "AdmitRefresh"
			},
			{
				"kind": "graph",
				"value": "BuildHttpRefreshOutcome"
			},
			{
				"kind": "graph",
				"value": "EmitSecurityAudit"
			},
			{
				"kind": "graph",
				"value": "MapFailureResponse"
			},
			{
				"kind": "graph",
				"value": "UpdateSessionMetrics"
			}
		]
	},
	"id": "bac6e6b25d0d97ba0d278e44d2a8904884e4c141eba044c6cb1df20eef6c7960",
	"integration": {
		"candidate": {
			"accepted": {
				"planDigest": {
					"algorithm": "sha256",
					"value": "8b890722f932e0e61e16cddde1a94f8c11cd66155200e1529e0cbbfc852ec5bd"
				},
				"policyDigest": {
					"algorithm": "sha256",
					"value": "e28e678ad14bf01c9f5b9c498978539ff21dd25f26a81825485f9f19d9fe648b"
				}
			},
			"evidence": {
				"baseBlueprint": {
					"blueprintHash": {
						"algorithm": "sha256",
						"value": "7c2a04e2c2f10dc39cb85cac16ea0b376b381c8ec263bffa8c00edd59d726a16"
					},
					"revision": {
						"algorithm": "sha1",
						"value": "f8c4d1978f9af3334105f51bcc3acff2852452f8"
					}
				},
				"candidateBlueprint": {
					"blueprintHash": {
						"algorithm": "sha256",
						"value": "7c2a04e2c2f10dc39cb85cac16ea0b376b381c8ec263bffa8c00edd59d726a16"
					},
					"revision": {
						"algorithm": "sha1",
						"value": "02cab67eaae43cddc9ccea125392bb1cccf71841"
					}
				},
				"headBlueprint": {
					"blueprintHash": {
						"algorithm": "sha256",
						"value": "7c2a04e2c2f10dc39cb85cac16ea0b376b381c8ec263bffa8c00edd59d726a16"
					},
					"revision": {
						"algorithm": "sha1",
						"value": "6e5ad729dd005c1c92656c1d20eef2a36ba1108e"
					}
				},
				"headDelta": {
					"deltaDigest": {
						"algorithm": "sha256",
						"value": "c616305934c9bfa8bb366ada18a99b29f3a119d5b0671e632acd3942a0c6858b"
					},
					"from": {
						"algorithm": "sha1",
						"value": "f8c4d1978f9af3334105f51bcc3acff2852452f8"
					},
					"to": {
						"algorithm": "sha1",
						"value": "6e5ad729dd005c1c92656c1d20eef2a36ba1108e"
					}
				},
				"targetBlueprint": {
					"blueprintHash": {
						"algorithm": "sha256",
						"value": "7c2a04e2c2f10dc39cb85cac16ea0b376b381c8ec263bffa8c00edd59d726a16"
					},
					"revision": {
						"algorithm": "sha1",
						"value": "3f7735ee97c774d56f4e2e439e1b2718919840e0"
					}
				},
				"targetDelta": {
					"deltaDigest": {
						"algorithm": "sha256",
						"value": "c616305934c9bfa8bb366ada18a99b29f3a119d5b0671e632acd3942a0c6858b"
					},
					"from": {
						"algorithm": "sha1",
						"value": "f8c4d1978f9af3334105f51bcc3acff2852452f8"
					},
					"to": {
						"algorithm": "sha1",
						"value": "3f7735ee97c774d56f4e2e439e1b2718919840e0"
					}
				}
			},
			"headGate": {
				"inputDigest": {
					"algorithm": "sha256",
					"value": "7a43649b249003a5b4f6c80287b85d39e7750048c295071ca06facdf1f8ae47b"
				},
				"resultDigest": {
					"algorithm": "sha256",
					"value": "fe7aad8a1cd0ce49ad2ecbfd468b168f66e247c145e4ad6005412d8a9bfc9b12"
				},
				"verdict": "pass"
			},
			"merge": {
				"algorithm": "git-ort-three-way",
				"revision": "v1",
				"status": "merged",
				"tree": {
					"algorithm": "sha1",
					"value": "02cab67eaae43cddc9ccea125392bb1cccf71841"
				}
			},
			"provider": {
				"kind": "graphrefly",
				"runtimeVersion": "0.8.0"
			},
			"repository": {
				"name": "refresh-session",
				"owner": "retained-fixture",
				"provider": "local"
			},
			"revisions": {
				"head": {
					"algorithm": "sha1",
					"value": "6e5ad729dd005c1c92656c1d20eef2a36ba1108e"
				},
				"mergeBase": {
					"algorithm": "sha1",
					"value": "f8c4d1978f9af3334105f51bcc3acff2852452f8"
				},
				"target": {
					"algorithm": "sha1",
					"value": "3f7735ee97c774d56f4e2e439e1b2718919840e0"
				}
			},
			"schema": "graphrefly.stack.integration-candidate.v1",
			"status": "ready",
			"topology": {
				"headRange": "linear",
				"mergeBase": "unique"
			}
		},
		"result": {
			"candidateDigest": {
				"algorithm": "sha256",
				"value": "e9066f6715b5b1376fc6797f96063922144c668575fe2d6414c8eee8c4d807df"
			},
			"conflicts": [],
			"observedRevisions": {
				"head": {
					"algorithm": "sha1",
					"value": "6e5ad729dd005c1c92656c1d20eef2a36ba1108e"
				},
				"target": {
					"algorithm": "sha1",
					"value": "3f7735ee97c774d56f4e2e439e1b2718919840e0"
				}
			},
			"outcome": "compatible",
			"overlaps": [],
			"reasonCodes": [],
			"schema": "graphrefly.stack.integration-result.v1"
		},
		"resultDigest": "b22ed2d4bcdadb813e3cc29ff9ad86f766a85cadc4e93ab8f44b556f2ffaec8b",
		"verification": {
			"candidateDeltaBinding": {
				"digest": "c616305934c9bfa8bb366ada18a99b29f3a119d5b0671e632acd3942a0c6858b",
				"from": "f8c4d1978f9af3334105f51bcc3acff2852452f8",
				"to": "02cab67eaae43cddc9ccea125392bb1cccf71841"
			},
			"candidateDigest": "e9066f6715b5b1376fc6797f96063922144c668575fe2d6414c8eee8c4d807df",
			"candidateTree": "02cab67eaae43cddc9ccea125392bb1cccf71841",
			"effectDigest": "25919ba588e8c8c1991355a5b2446a82f8c57aed8b33ac564b32520c12a5f889",
			"id": "78bcb76a134bbc18710eb7d6c3b6270875d3afeeae79f1baee5eb6199172872c",
			"inputs": {
				"candidateDelta": {
					"events": [],
					"fromBlueprintVersion": "graphrefly.blueprint.v2",
					"fromHash": {
						"algorithm": "sha256",
						"input": "strictCanonicalTopologyBytes",
						"kind": "topology",
						"value": "7c2a04e2c2f10dc39cb85cac16ea0b376b381c8ec263bffa8c00edd59d726a16"
					},
					"toBlueprintVersion": "graphrefly.blueprint.v2",
					"toHash": {
						"algorithm": "sha256",
						"input": "strictCanonicalTopologyBytes",
						"kind": "topology",
						"value": "7c2a04e2c2f10dc39cb85cac16ea0b376b381c8ec263bffa8c00edd59d726a16"
					},
					"version": "graphrefly.blueprint-delta.v1"
				},
				"headDelta": {
					"events": [],
					"fromBlueprintVersion": "graphrefly.blueprint.v2",
					"fromHash": {
						"algorithm": "sha256",
						"input": "strictCanonicalTopologyBytes",
						"kind": "topology",
						"value": "7c2a04e2c2f10dc39cb85cac16ea0b376b381c8ec263bffa8c00edd59d726a16"
					},
					"toBlueprintVersion": "graphrefly.blueprint.v2",
					"toHash": {
						"algorithm": "sha256",
						"input": "strictCanonicalTopologyBytes",
						"kind": "topology",
						"value": "7c2a04e2c2f10dc39cb85cac16ea0b376b381c8ec263bffa8c00edd59d726a16"
					},
					"version": "graphrefly.blueprint-delta.v1"
				},
				"targetDelta": {
					"events": [],
					"fromBlueprintVersion": "graphrefly.blueprint.v2",
					"fromHash": {
						"algorithm": "sha256",
						"input": "strictCanonicalTopologyBytes",
						"kind": "topology",
						"value": "7c2a04e2c2f10dc39cb85cac16ea0b376b381c8ec263bffa8c00edd59d726a16"
					},
					"toBlueprintVersion": "graphrefly.blueprint.v2",
					"toHash": {
						"algorithm": "sha256",
						"input": "strictCanonicalTopologyBytes",
						"kind": "topology",
						"value": "7c2a04e2c2f10dc39cb85cac16ea0b376b381c8ec263bffa8c00edd59d726a16"
					},
					"version": "graphrefly.blueprint-delta.v1"
				}
			},
			"resultDigest": "b22ed2d4bcdadb813e3cc29ff9ad86f766a85cadc4e93ab8f44b556f2ffaec8b",
			"schema": "graphrefly.stack.integration-result-verification.v1",
			"status": "verified",
			"verifierRef": "graphrefly-stack:retained-integration-result-verifier"
		}
	},
	"limitations": [
		"Structural reachability is not observed runtime occurrence or causality",
		"Human review and external owner admission remain independent and are not granted by this proof",
		"No-overlap-observed is scoped to declared coverage and is not an unconditional safety claim",
		"The combined candidate exists only in isolated temporary storage and is not retained as a Git ref"
	],
	"llmRequired": false,
	"projections": [
		{
			"blueprint": {
				"topologyHash": "7c2a04e2c2f10dc39cb85cac16ea0b376b381c8ec263bffa8c00edd59d726a16",
				"version": "graphrefly.blueprint.v2"
			},
			"changeId": "110fe2b5bf4cd9771ef632681fbcfeec6e45149ae34bd3ad68c6f4101cfbbe00",
			"coverage": {
				"bindings": "complete",
				"declared": [
					"AdmitRefresh",
					"ApplyBrokerPolicy",
					"BuildHttpRefreshOutcome",
					"EmitSecurityAudit",